<?xml version="1.0" encoding="UTF-8"?>
<tns:BS xmlns:tns="http://www.example.org/ServiceBanque" xmlns:xsi="http://www.w3.org/2001/XMLSchema-instance" xsi:schemaLocation="http://www.example.org/ServiceBanque ServiceBanque.xsd ">
  <tns:conversion>
    <tns:montant>0.0</tns:montant>
  </tns:conversion>
  <tns:GetCompte>
    <tns:code>0.0</tns:code>
    <tns:solde>0.0</tns:solde>
    <tns:date>2001-01-01</tns:date>
  </tns:GetCompte>
  <tns:GetComptes>
    <tns:code>0.0</tns:code>
    <tns:solde>0.0</tns:solde>
    <tns:date>2001-01-01</tns:date>
  </tns:GetComptes>
</tns:BS>
